{
  "schema_version": "adoc.portable_projection_input.v0",
  "workspace_id": "11111111-1111-1111-1111-111111111111",
  "projection_version": "1",
  "evaluation_date": "2026-09-08",
  "objects": [
    {
      "canonical": {
        "workspace_id": "11111111-1111-1111-1111-111111111111",
        "canonical_id": "22222222-2222-2222-2222-222222222222"
      },
      "version_id": "33333333-3333-3333-3333-333333333333",
      "object_id": "billing.retained",
      "original_content_digest": "sha256:db5c4b08591df39e9700171a4a165cb4318f805649d2c30fdfb01770e5468d25",
      "node_bytes": "{\"id\":\"billing.retained\",\"kind\":\"claim\",\"status\":\"draft\",\"severity\":null,\"trust\":null,\"body\":\"Retained billing claim.\",\"fields\":{\"owner\":\"billing\"},\"relations\":{\"depends_on\":[],\"supersedes\":[],\"related_to\":[]},\"impacts\":[],\"approved_by\":[],\"allowed_actions\":[],\"forbidden_actions\":[],\"contradiction_claims\":[],\"evidence\":[],\"content_hash\":\"sha256:abbd498bd0cbe52b5530bdf14775e4b4227600a325811524fdef9a933cd98fd0\",\"page_id\":\"guide\",\"source_span\":{\"path\":\"guide.adoc\",\"line\":1,\"column\":1},\"effective_status\":null,\"effective_reason\":null,\"evidence_quality\":null}",
      "node_digest": "sha256:db5c4b08591df39e9700171a4a165cb4318f805649d2c30fdfb01770e5468d25",
      "state_history_complete": true,
      "state_events": [],
      "preservation": {
        "content_record_key": "managed_version:one:content",
        "provenance_record_keys": [
          "assertion:one:record",
          "assertion:two:record"
        ],
        "replay_postures": [
          {
            "record_key": "posture:one:record",
            "posture": "no_longer_replayable_after_deletion"
          }
        ]
      }
    }
  ]
}
